{
  "membership_id": "44444444-4444-4444-8444-444444444444",
  "organization_id": "22222222-2222-4222-8222-222222222222",
  "member_id": "55555555-5555-4555-8555-555555555555",
  "display_name": "Ada Lovelace",
  "role": "admin",
  "status": "active",
  "version": 4,
  "created_at": "2026-08-12T00:02:00.000Z",
  "updated_at": "2026-08-12T00:02:00.000Z"
}
